{
  "feature_name": "db-normalization",
  "feature_full_name": "Database Schema Normalization",
  "phase": 7.1,
  "timestamp": "2026-01-06T12:00:00Z",
  "baseline": {
    "source": "results/db-normalization/phase6/analysis.json",
    "service_name": "num-allocation",
    "service_version": "1.6.0"
  },
  "requirements": {
    "source": "results/db-normalization/phase5/control-flow-mapping.json",
    "feature_name": "db-normalization"
  },
  "change_type": "REFACTORING",
  "change_description": "Major database normalization without changing API contracts",
  "complexity_score": 45,
  "is_breaking_change": false,
  "quality_target": 70,
  "changes": {
    "api_changes": {
      "endpoints_to_add": [],
      "endpoints_to_modify": [],
      "endpoints_to_deprecate": []
    },
    "database_changes": {
      "tables_to_add": [
        {
          "table_name": "number_allocation_history",
          "purpose": "Track historical allocations separately from active allocations",
          "ddl": "CREATE TABLE number_allocation_history (id UUID PRIMARY KEY, msisdn VARCHAR(15) NOT NULL, carrier_id UUID NOT NULL, allocated_at TIMESTAMP NOT NULL, deallocated_at TIMESTAMP, reason VARCHAR(200));"
        }
      ],
      "columns_to_add": [
        {
          "table_name": "number_allocations",
          "column_name": "migrated_from_legacy",
          "ddl": "ALTER TABLE number_allocations ADD COLUMN migrated_from_legacy BOOLEAN DEFAULT false;",
          "purpose": "Track which allocations came from RNVS migration vs VNRM native"
        }
      ],
      "indexes_to_add": [
        {
          "table_name": "number_allocation_history",
          "index_name": "idx_num_hist_msisdn_date",
          "columns": ["msisdn", "allocated_at"],
          "ddl": "CREATE INDEX idx_num_hist_msisdn_date ON number_allocation_history(msisdn, allocated_at DESC);",
          "purpose": "Optimize historical allocation queries"
        }
      ]
    },
    "event_changes": {
      "topics_to_add": [],
      "subscriptions_to_add": []
    },
    "state_machine_changes": {
      "new_states": [],
      "new_transitions": []
    },
    "dependency_changes": {
      "new_internal_dependencies": []
    }
  },
  "validation_report": {
    "overall_status": "COMPLETE",
    "overall_quality_score": 72,
    "validation_method": "MOCK"
  }
}
